### ISSUE TITLE
mosh reconnects even if it does not have to

### ISSUE THREAD

**Issue by jirislaby** [mobile-shell/mosh#1072]
When I scroll a `vim` too fast (using `mouse=a`) or resize `tig`, when there is a small network glitch, `mosh` shows:
```
mosh: Last contact 7 seconds ago. [To quit: Ctrl-^ .]
```
tcpdump shows a lot of communication but only new connection from a new port (at the bottom) helps:
```
11:39:44.792358 IP 10.100.200.156.36798 > 10.100.2.106.60001: UDP, length 88
11:39:44.814143 IP 10.100.200.156.36798 > 10.100.2.106.60001: UDP, length 93
11:39:44.837654 IP 10.100.200.156.36798 > 10.100.2.106.60001: UDP, length 85
11:39:44.856892 IP 10.100.2.106.60001 > 10.100.200.156.36798: UDP, length 166
11:39:44.857716 IP 10.100.200.156.36798 > 10.100.2.106.60001: UDP, length 81
11:39:44.877033 IP 10.100.2.106.60001 > 10.100.200.156.36798: UDP, length 148
11:39:44.884894 IP 10.100.200.156.36798 > 10.100.2.106.60001: UDP, length 77
11:39:44.903097 IP 10.100.2.106.60001 > 10.100.200.156.36798: UDP, length 171
11:39:44.916593 IP 10.100.200.156.36798 > 10.100.2.106.60001: UDP, length 90
11:39:44.941293 IP 10.100.200.156.36798 > 10.100.2.106.60001: UDP, length 95
11:39:44.961776 IP 10.100.200.156.36798 > 10.100.2.106.60001: UDP, length 93
11:39:44.967983 IP 10.100.2.106.60001 > 10.100.200.156.36798: UDP, length 215
11:39:44.982900 IP 10.100.200.156.36798 > 10.100.2.106.60001: UDP, length 77
11:39:44.987443 IP 10.100.2.106.60001 > 10.100.200.156.36798: UDP, length 229
11:39:45.094026 IP 10.100.200.156.36798 > 10.100.2.106.60001: UDP, length 85
11:39:45.201385 IP 10.100.2.106.60001 > 10.100.200.156.36798: UDP, length 171
11:39:45.222017 IP 10.100.2.106.60001 > 10.100.200.156.36798: UDP, length 161
11:39:45.262310 IP 10.100.2.106.60001 > 10.100.200.156.36798: UDP, length 161
11:39:45.282711 IP 10.100.2.106.60001 > 10.100.200.156.36798: UDP, length 159
11:39:45.303206 IP 10.100.2.106.60001 > 10.100.200.156.36798: UDP, length 161
11:39:45.307374 IP 10.100.200.156.36798 > 10.100.2.106.60001: UDP, length 72
11:39:45.773462 IP 10.100.200.156.36798 > 10.100.2.106.60001: UDP, length 81
11:39:45.799070 IP 10.100.200.156.36798 > 10.100.2.106.60001: UDP, length 85
11:39:45.818787 IP 10.100.2.106.60001 > 10.100.200.156.36798: UDP, length 1252
11:39:45.822169 IP 10.100.200.156.36798 > 10.100.2.106.60001: UDP, length 92
11:39:45.843660 IP 10.100.200.156.36798 > 10.100.2.106.60001: UDP, length 81
11:39:45.867811 IP 10.100.200.156.36798 > 10.100.2.106.60001: UDP, length 85
11:39:45.887112 IP 10.100.2.106.60001 > 10.100.200.156.36798: UDP, length 1252
11:39:45.890590 IP 10.100.200.156.36798 > 10.100.2.106.60001: UDP, length 97
11:39:45.913881 IP 10.100.200.156.36798 > 10.100.2.106.60001: UDP, length 87
11:39:45.935938 IP 10.100.200.156.36798 > 10.100.2.106.60001: UDP, length 86
11:39:45.958162 IP 10.100.200.156.36798 > 10.100.2.106.60001: UDP, length 82
11:39:45.960858 IP 10.100.2.106.60001 > 10.100.200.156.36798: UDP, length 1252
11:39:45.980751 IP 10.100.200.156.36798 > 10.100.2.106.60001: UDP, length 89
11:39:46.003498 IP 10.100.200.156.36798 > 10.100.2.106.60001: UDP, length 93
11:39:46.025517 IP 10.100.200.156.36798 > 10.100.2.106.60001: UDP, length 92
11:39:46.039693 IP 10.100.2.106.60001 > 10.100.200.156.36798: UDP, length 1252
11:39:46.047686 IP 10.100.200.156.36798 > 10.100.2.106.60001: UDP, length 97
11:39:46.069985 IP 10.100.200.156.36798 > 10.100.2.106.60001: UDP, length 88
11:39:46.095520 IP 10.100.200.156.36798 > 10.100.2.106.60001: UDP, length 103
11:39:46.118556 IP 10.100.200.156.36798 > 10.100.2.106.60001: UDP, length 97
11:39:46.120329 IP 10.100.2.106.60001 > 10.100.200.156.36798: UDP, length 1252
11:39:46.140768 IP 10.100.200.156.36798 > 10.100.2.106.60001: UDP, length 99
11:39:46.164400 IP 10.100.200.156.36798 > 10.100.2.106.60001: UDP, length 97
11:39:46.183162 IP 10.100.2.106.60001 > 10.100.200.156.36798: UDP, length 1252
11:39:46.185707 IP 10.100.200.156.36798 > 10.100.2.106.60001: UDP, length 107
11:39:46.205818 IP 10.100.200.156.36798 > 10.100.2.106.60001: UDP, length 103
11:39:46.227103 IP 10.100.200.156.36798 > 10.100.2.106.60001: UDP, length 99
11:39:46.247846 IP 10.100.200.156.36798 > 10.100.2.106.60001: UDP, length 97
11:39:46.254561 IP 10.100.2.106.60001 > 10.100.200.156.36798: UDP, length 1252
11:39:46.268586 IP 10.100.200.156.36798 > 10.100.2.106.60001: UDP, length 100
11:39:46.289545 IP 10.100.200.156.36798 > 10.100.2.106.60001: UDP, length 94
11:39:46.311141 IP 10.100.200.156.36798 > 10.100.2.106.60001: UDP, length 103
11:39:46.332599 IP 10.100.200.156.36798 > 10.100.2.106.60001: UDP, length 103
11:39:46.334677 IP 10.100.2.106.60001 > 10.100.200.156.36798: UDP, length 1252
11:39:46.353787 IP 10.100.200.156.36798 > 10.100.2.106.60001: UDP, length 106
11:39:46.375452 IP 10.100.200.156.36798 > 10.100.2.106.60001: UDP, length 97
11:39:46.396755 IP 10.100.200.156.36798 > 10.100.2.106.60001: UDP, length 94
11:39:46.418524 IP 10.100.200.156.36798 > 10.100.2.106.60001: UDP, length 105
11:39:46.440983 IP 10.100.200.156.36798 > 10.100.2.106.60001: UDP, length 102
11:39:46.463019 IP 10.100.200.156.36798 > 10.100.2.106.60001: UDP, length 110
11:39:46.486341 IP 10.100.200.156.36798 > 10.100.2.106.60001: UDP, length 106
11:39:46.495223 IP 10.100.2.106.60001 > 10.100.200.156.36798: UDP, length 1252
11:39:46.507757 IP 10.100.200.156.36798 > 10.100.2.106.60001: UDP, length 110
11:39:46.530055 IP 10.100.200.156.36798 > 10.100.2.106.60001: UDP, length 104
11:39:46.552215 IP 10.100.200.156.36798 > 10.100.2.106.60001: UDP, length 101
11:39:46.554663 IP 10.100.2.106.60001 > 10.100.200.156.36798: UDP, length 1252
11:39:46.573805 IP 10.100.200.156.36798 > 10.100.2.106.60001: UDP, length 107
11:39:46.595198 IP 10.100.200.156.36798 > 10.100.2.106.60001: UDP, length 103
11:39:46.619544 IP 10.100.200.156.36798 > 10.100.2.106.60001: UDP, length 109
11:39:46.634884 IP 10.100.2.106.60001 > 10.100.200.156.36798: UDP, length 1252
11:39:46.640195 IP 10.100.200.156.36798 > 10.100.2.106.60001: UDP, length 97
11:39:46.663486 IP 10.100.200.156.36798 > 10.100.2.106.60001: UDP, length 100
11:39:46.685689 IP 10.100.200.156.36798 > 10.100.2.106.60001: UDP, length 107
11:39:46.709510 IP 10.100.200.156.36798 > 10.100.2.106.60001: UDP, length 110
11:39:46.715530 IP 10.100.2.106.60001 > 10.100.200.156.36798: UDP, length 1252
11:39:46.732793 IP 10.100.200.156.36798 > 10.100.2.106.60001: UDP, length 99
11:39:46.755085 IP 10.100.200.156.36798 > 10.100.2.106.60001: UDP, length 103
11:39:46.776539 IP 10.100.200.156.36798 > 10.100.2.106.60001: UDP, length 107
11:39:46.794914 IP 10.100.2.106.60001 > 10.100.200.156.36798: UDP, length 1252
11:39:46.797682 IP 10.100.200.156.36798 > 10.100.2.106.60001: UDP, length 108
11:39:46.821105 IP 10.100.200.156.36798 > 10.100.2.106.60001: UDP, length 98
11:39:46.843021 IP 10.100.200.156.36798 > 10.100.2.106.60001: UDP, length 108
11:39:46.855156 IP 10.100.2.106.60001 > 10.100.200.156.36798: UDP, length 1252
11:39:46.865737 IP 10.100.200.156.36798 > 10.100.2.106.60001: UDP, length 96
11:39:46.887519 IP 10.100.200.156.36798 > 10.100.2.106.60001: UDP, length 98
11:39:46.909416 IP 10.100.200.156.36798 > 10.100.2.106.60001: UDP, length 107
11:39:46.931506 IP 10.100.200.156.36798 > 10.100.2.106.60001: UDP, length 108
11:39:46.935643 IP 10.100.2.106.60001 > 10.100.200.156.36798: UDP, length 1252
11:39:46.952483 IP 10.100.200.156.36798 > 10.100.2.106.60001: UDP, length 97
11:39:46.975257 IP 10.100.200.156.36798 > 10.100.2.106.60001: UDP, length 105
11:39:46.997079 IP 10.100.200.156.36798 > 10.100.2.106.60001: UDP, length 109
11:39:47.016042 IP 10.100.2.106.60001 > 10.100.200.156.36798: UDP, length 1252
11:39:47.018200 IP 10.100.200.156.36798 > 10.100.2.106.60001: UDP, length 109
11:39:47.039932 IP 10.100.200.156.36798 > 10.100.2.106.60001: UDP, length 104
11:39:47.061612 IP 10.100.200.156.36798 > 10.100.2.106.60001: UDP, length 106
11:39:47.076021 IP 10.100.2.106.60001 > 10.100.200.156.36798: UDP, length 1252
11:39:47.083687 IP 10.100.200.156.36798 > 10.100.2.106.60001: UDP, length 102
11:39:47.105918 IP 10.100.200.156.36798 > 10.100.2.106.60001: UDP, length 107
11:39:47.127857 IP 10.100.200.156.36798 > 10.100.2.106.60001: UDP, length 110
11:39:47.149548 IP 10.100.200.156.36798 > 10.100.2.106.60001: UDP, length 105
11:39:47.155822 IP 10.100.2.106.60001 > 10.100.200.156.36798: UDP, length 1252
11:39:47.172165 IP 10.100.200.156.36798 > 10.100.2.106.60001: UDP, length 106
11:39:47.194049 IP 10.100.200.156.36798 > 10.100.2.106.60001: UDP, length 102
11:39:47.216802 IP 10.100.200.156.36798 > 10.100.2.106.60001: UDP, length 97
11:39:47.236060 IP 10.100.2.106.60001 > 10.100.200.156.36798: UDP, length 1252
11:39:47.237470 IP 10.100.200.156.36798 > 10.100.2.106.60001: UDP, length 108
11:39:47.258778 IP 10.100.200.156.36798 > 10.100.2.106.60001: UDP, length 111
11:39:47.280144 IP 10.100.200.156.36798 > 10.100.2.106.60001: UDP, length 101
11:39:47.295658 IP 10.100.2.106.60001 > 10.100.200.156.36798: UDP, length 1252
11:39:47.303798 IP 10.100.200.156.36798 > 10.100.2.106.60001: UDP, length 107
11:39:47.325796 IP 10.100.200.156.36798 > 10.100.2.106.60001: UDP, length 112
11:39:47.347480 IP 10.100.200.156.36798 > 10.100.2.106.60001: UDP, length 97
11:39:47.369528 IP 10.100.200.156.36798 > 10.100.2.106.60001: UDP, length 103
11:39:47.375941 IP 10.100.2.106.60001 > 10.100.200.156.36798: UDP, length 1252
11:39:47.391276 IP 10.100.200.156.36798 > 10.100.2.106.60001: UDP, length 95
11:39:47.413856 IP 10.100.200.156.36798 > 10.100.2.106.60001: UDP, length 97
11:39:47.435249 IP 10.100.200.156.36798 > 10.100.2.106.60001: UDP, length 105
11:39:47.455676 IP 10.100.2.106.60001 > 10.100.200.156.36798: UDP, length 1252
11:39:47.457552 IP 10.100.200.156.36798 > 10.100.2.106.60001: UDP, length 104
11:39:47.479653 IP 10.100.200.156.36798 > 10.100.2.106.60001: UDP, length 102
11:39:47.501403 IP 10.100.200.156.36798 > 10.100.2.106.60001: UDP, length 106
11:39:47.515627 IP 10.100.2.106.60001 > 10.100.200.156.36798: UDP, length 1252
11:39:47.524615 IP 10.100.200.156.36798 > 10.100.2.106.60001: UDP, length 97
11:39:47.546585 IP 10.100.200.156.36798 > 10.100.2.106.60001: UDP, length 96
11:39:47.568119 IP 10.100.200.156.36798 > 10.100.2.106.60001: UDP, length 105
11:39:47.590322 IP 10.100.200.156.36798 > 10.100.2.106.60001: UDP, length 111
11:39:47.596193 IP 10.100.2.106.60001 > 10.100.200.156.36798: UDP, length 1252
11:39:47.613637 IP 10.100.200.156.36798 > 10.100.2.106.60001: UDP, length 103
11:39:47.636330 IP 10.100.200.156.36798 > 10.100.2.106.60001: UDP, length 108
11:39:47.658097 IP 10.100.200.156.36798 > 10.100.2.106.60001: UDP, length 94
11:39:47.675507 IP 10.100.2.106.60001 > 10.100.200.156.36798: UDP, length 1252
11:39:47.679929 IP 10.100.200.156.36798 > 10.100.2.106.60001: UDP, length 96
11:39:47.701740 IP 10.100.200.156.36798 > 10.100.2.106.60001: UDP, length 96
11:39:47.724015 IP 10.100.200.156.36798 > 10.100.2.106.60001: UDP, length 95
11:39:47.735675 IP 10.100.2.106.60001 > 10.100.200.156.36798: UDP, length 1252
11:39:47.744340 IP 10.100.200.156.36798 > 10.100.2.106.60001: UDP, length 100
11:39:47.766435 IP 10.100.200.156.36798 > 10.100.2.106.60001: UDP, length 107
11:39:47.787972 IP 10.100.200.156.36798 > 10.100.2.106.60001: UDP, length 111
11:39:47.810020 IP 10.100.200.156.36798 > 10.100.2.106.60001: UDP, length 101
11:39:47.816137 IP 10.100.2.106.60001 > 10.100.200.156.36798: UDP, length 1252
11:39:47.832072 IP 10.100.200.156.36798 > 10.100.2.106.60001: UDP, length 99
11:39:47.854339 IP 10.100.200.156.36798 > 10.100.2.106.60001: UDP, length 103
11:39:47.877358 IP 10.100.200.156.36798 > 10.100.2.106.60001: UDP, length 94
11:39:47.895797 IP 10.100.2.106.60001 > 10.100.200.156.36798: UDP, length 1252
11:39:47.897675 IP 10.100.200.156.36798 > 10.100.2.106.60001: UDP, length 108
11:39:47.920040 IP 10.100.200.156.36798 > 10.100.2.106.60001: UDP, length 96
11:39:47.942487 IP 10.100.200.156.36798 > 10.100.2.106.60001: UDP, length 95
11:39:47.955748 IP 10.100.2.106.60001 > 10.100.200.156.36798: UDP, length 1252
11:39:47.963753 IP 10.100.200.156.36798 > 10.100.2.106.60001: UDP, length 109
11:39:47.985108 IP 10.100.200.156.36798 > 10.100.2.106.60001: UDP, length 97
11:39:48.007123 IP 10.100.200.156.36798 > 10.100.2.106.60001: UDP, length 111
11:39:48.029548 IP 10.100.200.156.36798 > 10.100.2.106.60001: UDP, length 97
11:39:48.035929 IP 10.100.2.106.60001 > 10.100.200.156.36798: UDP, length 1252
11:39:48.054617 IP 10.100.200.156.36798 > 10.100.2.106.60001: UDP, length 94
11:39:48.076188 IP 10.100.200.156.36798 > 10.100.2.106.60001: UDP, length 107
11:39:48.097996 IP 10.100.200.156.36798 > 10.100.2.106.60001: UDP, length 99
11:39:48.115359 IP 10.100.2.106.60001 > 10.100.200.156.36798: UDP, length 1252
11:39:48.120076 IP 10.100.200.156.36798 > 10.100.2.106.60001: UDP, length 108
11:39:48.148404 IP 10.100.200.156.36798 > 10.100.2.106.60001: UDP, length 95
11:39:48.170626 IP 10.100.200.156.36798 > 10.100.2.106.60001: UDP, length 109
11:39:48.192847 IP 10.100.200.156.36798 > 10.100.2.106.60001: UDP, length 94
11:39:48.196165 IP 10.100.2.106.60001 > 10.100.200.156.36798: UDP, length 1252
11:39:48.214682 IP 10.100.200.156.36798 > 10.100.2.106.60001: UDP, length 109
11:39:48.236759 IP 10.100.200.156.36798 > 10.100.2.106.60001: UDP, length 105
11:39:48.255725 IP 10.100.2.106.60001 > 10.100.200.156.36798: UDP, length 1252
11:39:48.258120 IP 10.100.200.156.36798 > 10.100.2.106.60001: UDP, length 107
11:39:48.279758 IP 10.100.200.156.36798 > 10.100.2.106.60001: UDP, length 110
11:39:48.301178 IP 10.100.200.156.36798 > 10.100.2.106.60001: UDP, length 96
11:39:48.322874 IP 10.100.200.156.36798 > 10.100.2.106.60001: UDP, length 102
11:39:48.335949 IP 10.100.2.106.60001 > 10.100.200.156.36798: UDP, length 1252
11:39:48.344924 IP 10.100.200.156.36798 > 10.100.2.106.60001: UDP, length 103
11:39:48.366329 IP 10.100.200.156.36798 > 10.100.2.106.60001: UDP, length 105
11:39:48.387952 IP 10.100.200.156.36798 > 10.100.2.106.60001: UDP, length 109
11:39:48.409701 IP 10.100.200.156.36798 > 10.100.2.106.60001: UDP, length 106
11:39:48.415758 IP 10.100.2.106.60001 > 10.100.200.156.36798: UDP, length 1252
11:39:48.431834 IP 10.100.200.156.36798 > 10.100.2.106.60001: UDP, length 109
11:39:48.453419 IP 10.100.200.156.36798 > 10.100.2.106.60001: UDP, length 105
11:39:48.475100 IP 10.100.200.156.36798 > 10.100.2.106.60001: UDP, length 106
11:39:48.476428 IP 10.100.2.106.60001 > 10.100.200.156.36798: UDP, length 1252
11:39:48.497836 IP 10.100.200.156.36798 > 10.100.2.106.60001: UDP, length 101
11:39:48.519227 IP 10.100.200.156.36798 > 10.100.2.106.60001: UDP, length 106
11:39:48.540687 IP 10.100.200.156.36798 > 10.100.2.106.60001: UDP, length 103
11:39:48.556009 IP 10.100.2.106.60001 > 10.100.200.156.36798: UDP, length 1252
11:39:48.562520 IP 10.100.200.156.36798 > 10.100.2.106.60001: UDP, length 95
11:39:48.584488 IP 10.100.200.156.36798 > 10.100.2.106.60001: UDP, length 106
11:39:48.606928 IP 10.100.200.156.36798 > 10.100.2.106.60001: UDP, length 105
11:39:48.628379 IP 10.100.200.156.36798 > 10.100.2.106.60001: UDP, length 104
11:39:48.636492 IP 10.100.2.106.60001 > 10.100.200.156.36798: UDP, length 1252
11:39:48.649573 IP 10.100.200.156.36798 > 10.100.2.106.60001: UDP, length 102
11:39:48.671538 IP 10.100.200.156.36798 > 10.100.2.106.60001: UDP, length 109
11:39:48.693447 IP 10.100.200.156.36798 > 10.100.2.106.60001: UDP, length 109
11:39:48.695771 IP 10.100.2.106.60001 > 10.100.200.156.36798: UDP, length 1252
11:39:48.715231 IP 10.100.200.156.36798 > 10.100.2.106.60001: UDP, length 108
11:39:48.737567 IP 10.100.200.156.36798 > 10.100.2.106.60001: UDP, length 102
11:39:48.759321 IP 10.100.200.156.36798 > 10.100.2.106.60001: UDP, length 111
11:39:48.776326 IP 10.100.2.106.60001 > 10.100.200.156.36798: UDP, length 1252
11:39:48.781482 IP 10.100.200.156.36798 > 10.100.2.106.60001: UDP, length 108
11:39:48.803362 IP 10.100.200.156.36798 > 10.100.2.106.60001: UDP, length 109
11:39:48.825153 IP 10.100.200.156.36798 > 10.100.2.106.60001: UDP, length 98
11:39:48.846729 IP 10.100.200.156.36798 > 10.100.2.106.60001: UDP, length 107
11:39:48.856153 IP 10.100.2.106.60001 > 10.100.200.156.36798: UDP, length 1252
11:39:48.868730 IP 10.100.200.156.36798 > 10.100.2.106.60001: UDP, length 95
11:39:48.891462 IP 10.100.200.156.36798 > 10.100.2.106.60001: UDP, length 106
11:39:48.912762 IP 10.100.200.156.36798 > 10.100.2.106.60001: UDP, length 111
11:39:48.934771 IP 10.100.200.156.36798 > 10.100.2.106.60001: UDP, length 103
11:39:48.955752 IP 10.100.2.106.60001 > 10.100.200.156.36798: UDP, length 1252
11:39:48.957763 IP 10.100.200.156.36798 > 10.100.2.106.60001: UDP, length 111
11:39:48.980472 IP 10.100.200.156.36798 > 10.100.2.106.60001: UDP, length 105
11:39:49.002509 IP 10.100.200.156.36798 > 10.100.2.106.60001: UDP, length 96
11:39:49.024281 IP 10.100.200.156.36798 > 10.100.2.106.60001: UDP, length 106
11:39:49.036031 IP 10.100.2.106.60001 > 10.100.200.156.36798: UDP, length 1252
11:39:49.045551 IP 10.100.200.156.36798 > 10.100.2.106.60001: UDP, length 109
11:39:49.067180 IP 10.100.200.156.36798 > 10.100.2.106.60001: UDP, length 104
11:39:49.089302 IP 10.100.200.156.36798 > 10.100.2.106.60001: UDP, length 98
11:39:49.096066 IP 10.100.2.106.60001 > 10.100.200.156.36798: UDP, length 1252
11:39:49.110872 IP 10.100.200.156.36798 > 10.100.2.106.60001: UDP, length 110
11:39:49.132179 IP 10.100.200.156.36798 > 10.100.2.106.60001: UDP, length 103
11:39:49.154186 IP 10.100.200.156.36798 > 10.100.2.106.60001: UDP, length 104
11:39:49.175770 IP 10.100.2.106.60001 > 10.100.200.156.36798: UDP, length 1252
11:39:49.176490 IP 10.100.200.156.36798 > 10.100.2.106.60001: UDP, length 94
11:39:49.198667 IP 10.100.200.156.36798 > 10.100.2.106.60001: UDP, length 107
11:39:49.220394 IP 10.100.200.156.36798 > 10.100.2.106.60001: UDP, length 96
11:39:49.242364 IP 10.100.200.156.36798 > 10.100.2.106.60001: UDP, length 110
11:39:49.256035 IP 10.100.2.106.60001 > 10.100.200.156.36798: UDP, length 1252
11:39:49.263589 IP 10.100.200.156.36798 > 10.100.2.106.60001: UDP, length 99
11:39:49.285674 IP 10.100.200.156.36798 > 10.100.2.106.60001: UDP, length 105
11:39:49.307273 IP 10.100.200.156.36798 > 10.100.2.106.60001: UDP, length 97
11:39:49.328686 IP 10.100.200.156.36798 > 10.100.2.106.60001: UDP, length 96
11:39:49.335778 IP 10.100.2.106.60001 > 10.100.200.156.36798: UDP, length 1252
11:39:49.349874 IP 10.100.200.156.36798 > 10.100.2.106.60001: UDP, length 94
11:39:49.371829 IP 10.100.200.156.36798 > 10.100.2.106.60001: UDP, length 111
11:39:49.393221 IP 10.100.200.156.36798 > 10.100.2.106.60001: UDP, length 98
11:39:49.415510 IP 10.100.200.156.36798 > 10.100.2.106.60001: UDP, length 110
11:39:49.438057 IP 10.100.200.156.36798 > 10.100.2.106.60001: UDP, length 94
11:39:49.460152 IP 10.100.200.156.36798 > 10.100.2.106.60001: UDP, length 108
11:39:49.481936 IP 10.100.200.156.36798 > 10.100.2.106.60001: UDP, length 108
11:39:49.504243 IP 10.100.200.156.36798 > 10.100.2.106.60001: UDP, length 99
11:39:49.525898 IP 10.100.200.156.36798 > 10.100.2.106.60001: UDP, length 103
11:39:49.547783 IP 10.100.200.156.36798 > 10.100.2.106.60001: UDP, length 103
11:39:49.556306 IP 10.100.2.106.60001 > 10.100.200.156.36798: UDP, length 1252
11:39:49.569984 IP 10.100.200.156.36798 > 10.100.2.106.60001: UDP, length 100
11:39:49.591320 IP 10.100.200.156.36798 > 10.100.2.106.60001: UDP, length 96
11:39:49.613128 IP 10.100.200.156.36798 > 10.100.2.106.60001: UDP, length 104
11:39:49.616530 IP 10.100.2.106.60001 > 10.100.200.156.36798: UDP, length 1252
11:39:49.634667 IP 10.100.200.156.36798 > 10.100.2.106.60001: UDP, length 96
11:39:49.656839 IP 10.100.200.156.36798 > 10.100.2.106.60001: UDP, length 108
11:39:49.678151 IP 10.100.200.156.36798 > 10.100.2.106.60001: UDP, length 94
11:39:49.696720 IP 10.100.2.106.60001 > 10.100.200.156.36798: UDP, length 1252
11:39:49.698369 IP 10.100.200.156.36798 > 10.100.2.106.60001: UDP, length 95
11:39:49.720687 IP 10.100.200.156.36798 > 10.100.2.106.60001: UDP, length 98
11:39:49.742423 IP 10.100.200.156.36798 > 10.100.2.106.60001: UDP, length 95
11:39:49.767202 IP 10.100.200.156.36798 > 10.100.2.106.60001: UDP, length 110
11:39:49.777168 IP 10.100.2.106.60001 > 10.100.200.156.36798: UDP, length 1252
11:39:49.787895 IP 10.100.200.156.36798 > 10.100.2.106.60001: UDP, length 105
11:39:49.814683 IP 10.100.200.156.36798 > 10.100.2.106.60001: UDP, length 99
11:39:49.836625 IP 10.100.200.156.36798 > 10.100.2.106.60001: UDP, length 111
11:39:49.837204 IP 10.100.2.106.60001 > 10.100.200.156.36798: UDP, length 1252
11:39:49.857984 IP 10.100.200.156.36798 > 10.100.2.106.60001: UDP, length 97
11:39:49.880694 IP 10.100.200.156.36798 > 10.100.2.106.60001: UDP, length 106
11:39:49.902721 IP 10.100.200.156.36798 > 10.100.2.106.60001: UDP, length 107
11:39:49.916655 IP 10.100.2.106.60001 > 10.100.200.156.36798: UDP, length 1252
11:39:49.924413 IP 10.100.200.156.36798 > 10.100.2.106.60001: UDP, length 99
11:39:49.947083 IP 10.100.200.156.36798 > 10.100.2.106.60001: UDP, length 111
11:39:49.968948 IP 10.100.200.156.36798 > 10.100.2.106.60001: UDP, length 103
11:39:49.990666 IP 10.100.200.156.36798 > 10.100.2.106.60001: UDP, length 107
11:39:49.997242 IP 10.100.2.106.60001 > 10.100.200.156.36798: UDP, length 1252
11:39:50.013068 IP 10.100.200.156.36798 > 10.100.2.106.60001: UDP, length 106
11:39:50.036171 IP 10.100.200.156.36798 > 10.100.2.106.60001: UDP, length 105
11:39:50.057033 IP 10.100.2.106.60001 > 10.100.200.156.36798: UDP, length 1252
11:39:50.058583 IP 10.100.200.156.36798 > 10.100.2.106.60001: UDP, length 111
11:39:50.079866 IP 10.100.200.156.36798 > 10.100.2.106.60001: UDP, length 111
11:39:50.101935 IP 10.100.200.156.36798 > 10.100.2.106.60001: UDP, length 105
11:39:50.123742 IP 10.100.200.156.36798 > 10.100.2.106.60001: UDP, length 104
11:39:50.136434 IP 10.100.2.106.60001 > 10.100.200.156.36798: UDP, length 1252
11:39:50.145077 IP 10.100.200.156.36798 > 10.100.2.106.60001: UDP, length 110
11:39:50.166864 IP 10.100.200.156.36798 > 10.100.2.106.60001: UDP, length 100
11:39:50.188907 IP 10.100.200.156.36798 > 10.100.2.106.60001: UDP, length 108
11:39:50.210994 IP 10.100.200.156.36798 > 10.100.2.106.60001: UDP, length 109
11:39:50.217201 IP 10.100.2.106.60001 > 10.100.200.156.36798: UDP, length 1252
11:39:50.233034 IP 10.100.200.156.36798 > 10.100.2.106.60001: UDP, length 110
11:39:50.255551 IP 10.100.200.156.36798 > 10.100.2.106.60001: UDP, length 106
11:39:50.277308 IP 10.100.2.106.60001 > 10.100.200.156.36798: UDP, length 1252
11:39:50.277357 IP 10.100.200.156.36798 > 10.100.2.106.60001: UDP, length 107
11:39:50.299265 IP 10.100.200.156.36798 > 10.100.2.106.60001: UDP, length 102
11:39:50.320801 IP 10.100.200.156.36798 > 10.100.2.106.60001: UDP, length 109
11:39:50.342224 IP 10.100.200.156.36798 > 10.100.2.106.60001: UDP, length 96
11:39:50.356649 IP 10.100.2.106.60001 > 10.100.200.156.36798: UDP, length 1252
11:39:50.363694 IP 10.100.200.156.36798 > 10.100.2.106.60001: UDP, length 109
11:39:50.385888 IP 10.100.200.156.36798 > 10.100.2.106.60001: UDP, length 106
11:39:50.407186 IP 10.100.200.156.36798 > 10.100.2.106.60001: UDP, length 96
11:39:50.428938 IP 10.100.200.156.36798 > 10.100.2.106.60001: UDP, length 102
11:39:50.437140 IP 10.100.2.106.60001 > 10.100.200.156.36798: UDP, length 1252
11:39:50.449217 IP 10.100.200.156.36798 > 10.100.2.106.60001: UDP, length 99
11:39:50.470482 IP 10.100.200.156.36798 > 10.100.2.106.60001: UDP, length 108
11:39:50.491982 IP 10.100.200.156.36798 > 10.100.2.106.60001: UDP, length 104
11:39:50.496651 IP 10.100.2.106.60001 > 10.100.200.156.36798: UDP, length 1252
11:39:50.513463 IP 10.100.200.156.36798 > 10.100.2.106.60001: UDP, length 103
11:39:50.535213 IP 10.100.200.156.36798 > 10.100.2.106.60001: UDP, length 106
11:39:50.557575 IP 10.100.200.156.36798 > 10.100.2.106.60001: UDP, length 111
11:39:50.576983 IP 10.100.2.106.60001 > 10.100.200.156.36798: UDP, length 1252
11:39:50.578493 IP 10.100.200.156.36798 > 10.100.2.106.60001: UDP, length 104
11:39:50.600006 IP 10.100.200.156.36798 > 10.100.2.106.60001: UDP, length 107
11:39:50.621357 IP 10.100.200.156.36798 > 10.100.2.106.60001: UDP, length 103
11:39:50.642969 IP 10.100.200.156.36798 > 10.100.2.106.60001: UDP, length 101
11:39:50.656578 IP 10.100.2.106.60001 > 10.100.200.156.36798: UDP, length 1252
11:39:50.665154 IP 10.100.200.156.36798 > 10.100.2.106.60001: UDP, length 110
11:39:50.686970 IP 10.100.200.156.36798 > 10.100.2.106.60001: UDP, length 97
11:39:50.708608 IP 10.100.200.156.36798 > 10.100.2.106.60001: UDP, length 112
11:39:50.730107 IP 10.100.200.156.36798 > 10.100.2.106.60001: UDP, length 107
11:39:50.736903 IP 10.100.2.106.60001 > 10.100.200.156.36798: UDP, length 1252
11:39:50.751205 IP 10.100.200.156.36798 > 10.100.2.106.60001: UDP, length 111
11:39:50.773855 IP 10.100.200.156.36798 > 10.100.2.106.60001: UDP, length 106
11:39:50.796942 IP 10.100.2.106.60001 > 10.100.200.156.36798: UDP, length 1252
11:39:50.797351 IP 10.100.200.156.36798 > 10.100.2.106.60001: UDP, length 95
11:39:50.819528 IP 10.100.200.156.36798 > 10.100.2.106.60001: UDP, length 94
11:39:50.841334 IP 10.100.200.156.36798 > 10.100.2.106.60001: UDP, length 108
11:39:50.863178 IP 10.100.200.156.36798 > 10.100.2.106.60001: UDP, length 110
11:39:50.876537 IP 10.100.2.106.60001 > 10.100.200.156.36798: UDP, length 1252
11:39:50.885258 IP 10.100.200.156.36798 > 10.100.2.106.60001: UDP, length 94
11:39:50.908678 IP 10.100.200.156.36798 > 10.100.2.106.60001: UDP, length 94
11:39:50.933638 IP 10.100.200.156.36798 > 10.100.2.106.60001: UDP, length 107
11:39:50.955087 IP 10.100.200.156.36798 > 10.100.2.106.60001: UDP, length 105
11:39:50.957143 IP 10.100.2.106.60001 > 10.100.200.156.36798: UDP, length 1252
11:39:50.977587 IP 10.100.200.156.36798 > 10.100.2.106.60001: UDP, length 100
11:39:50.999492 IP 10.100.200.156.36798 > 10.100.2.106.60001: UDP, length 111
11:39:51.016869 IP 10.100.2.106.60001 > 10.100.200.156.36798: UDP, length 1252
11:39:51.020465 IP 10.100.200.156.36798 > 10.100.2.106.60001: UDP, length 105
11:39:51.042396 IP 10.100.200.156.36798 > 10.100.2.106.60001: UDP, length 105
11:39:51.064361 IP 10.100.200.156.36798 > 10.100.2.106.60001: UDP, length 95
11:39:51.087141 IP 10.100.200.156.36798 > 10.100.2.106.60001: UDP, length 103
11:39:51.097846 IP 10.100.2.106.60001 > 10.100.200.156.36798: UDP, length 1252
11:39:51.109783 IP 10.100.200.156.36798 > 10.100.2.106.60001: UDP, length 95
11:39:51.131344 IP 10.100.200.156.36798 > 10.100.2.106.60001: UDP, length 98
11:39:51.152268 IP 10.100.200.156.36798 > 10.100.2.106.60001: UDP, length 102
11:39:51.174054 IP 10.100.200.156.36798 > 10.100.2.106.60001: UDP, length 99
11:39:51.177070 IP 10.100.2.106.60001 > 10.100.200.156.36798: UDP, length 1252
11:39:51.195879 IP 10.100.200.156.36798 > 10.100.2.106.60001: UDP, length 105
11:39:51.217824 IP 10.100.200.156.36798 > 10.100.2.106.60001: UDP, length 105
11:39:51.237048 IP 10.100.2.106.60001 > 10.100.200.156.36798: UDP, length 1252
11:39:51.241049 IP 10.100.200.156.36798 > 10.100.2.106.60001: UDP, length 108
11:39:51.263444 IP 10.100.200.156.36798 > 10.100.2.106.60001: UDP, length 106
11:39:51.285926 IP 10.100.200.156.36798 > 10.100.2.106.60001: UDP, length 109
11:39:51.307539 IP 10.100.200.156.36798 > 10.100.2.106.60001: UDP, length 109
11:39:51.316875 IP 10.100.2.106.60001 > 10.100.200.156.36798: UDP, length 1252
11:39:51.328572 IP 10.100.200.156.36798 > 10.100.2.106.60001: UDP, length 105
11:39:51.350297 IP 10.100.200.156.36798 > 10.100.2.106.60001: UDP, length 97
11:39:51.372576 IP 10.100.200.156.36798 > 10.100.2.106.60001: UDP, length 97
11:39:51.394534 IP 10.100.200.156.36798 > 10.100.2.106.60001: UDP, length 94
11:39:51.396663 IP 10.100.2.106.60001 > 10.100.200.156.36798: UDP, length 1252
11:39:51.416516 IP 10.100.200.156.36798 > 10.100.2.106.60001: UDP, length 97
11:39:51.437954 IP 10.100.200.156.36798 > 10.100.2.106.60001: UDP, length 97
11:39:51.456267 IP 10.100.2.106.60001 > 10.100.200.156.36798: UDP, length 1252
11:39:51.459572 IP 10.100.200.156.36798 > 10.100.2.106.60001: UDP, length 110
11:39:51.482151 IP 10.100.200.156.36798 > 10.100.2.106.60001: UDP, length 105
11:39:51.504983 IP 10.100.200.156.36798 > 10.100.2.106.60001: UDP, length 110
11:39:51.527083 IP 10.100.200.156.36798 > 10.100.2.106.60001: UDP, length 101
11:39:51.537136 IP 10.100.2.106.60001 > 10.100.200.156.36798: UDP, length 1252
11:39:51.548914 IP 10.100.200.156.36798 > 10.100.2.106.60001: UDP, length 99
11:39:51.571423 IP 10.100.200.156.36798 > 10.100.2.106.60001: UDP, length 111
11:39:51.594162 IP 10.100.200.156.36798 > 10.100.2.106.60001: UDP, length 96
11:39:51.616410 IP 10.100.2.106.60001 > 10.100.200.156.36798: UDP, length 1252
11:39:51.616559 IP 10.100.200.156.36798 > 10.100.2.106.60001: UDP, length 99
11:39:51.637646 IP 10.100.200.156.36798 > 10.100.2.106.60001: UDP, length 97
11:39:51.659517 IP 10.100.200.156.36798 > 10.100.2.106.60001: UDP, length 98
11:39:51.676659 IP 10.100.2.106.60001 > 10.100.200.156.36798: UDP, length 1252
11:39:51.680487 IP 10.100.200.156.36798 > 10.100.2.106.60001: UDP, length 111
11:39:51.704783 IP 10.100.200.156.36798 > 10.100.2.106.60001: UDP, length 98
11:39:51.728957 IP 10.100.200.156.36798 > 10.100.2.106.60001: UDP, length 94
11:39:51.750478 IP 10.100.200.156.36798 > 10.100.2.106.60001: UDP, length 109
11:39:51.757240 IP 10.100.2.106.60001 > 10.100.200.156.36798: UDP, length 1252
11:39:51.771697 IP 10.100.200.156.36798 > 10.100.2.106.60001: UDP, length 106
11:39:51.793813 IP 10.100.200.156.36798 > 10.100.2.106.60001: UDP, length 97
11:39:51.815377 IP 10.100.200.156.36798 > 10.100.2.106.60001: UDP, length 96
11:39:51.836878 IP 10.100.2.106.60001 > 10.100.200.156.36798: UDP, length 1252
11:39:51.836913 IP 10.100.200.156.36798 > 10.100.2.106.60001: UDP, length 101
11:39:51.858405 IP 10.100.200.156.36798 > 10.100.2.106.60001: UDP, length 103
11:39:51.880991 IP 10.100.200.156.36798 > 10.100.2.106.60001: UDP, length 103
11:39:51.897276 IP 10.100.2.106.60001 > 10.100.200.156.36798: UDP, length 1252
11:39:51.903126 IP 10.100.200.156.36798 > 10.100.2.106.60001: UDP, length 97
11:39:51.925554 IP 10.100.200.156.36798 > 10.100.2.106.60001: UDP, length 97
11:39:51.947286 IP 10.100.200.156.36798 > 10.100.2.106.60001: UDP, length 94
11:39:51.968916 IP 10.100.200.156.36798 > 10.100.2.106.60001: UDP, length 95
11:39:51.978457 IP 10.100.2.106.60001 > 10.100.200.156.36798: UDP, length 1252
11:39:51.991220 IP 10.100.200.156.36798 > 10.100.2.106.60001: UDP, length 102
11:39:52.014168 IP 10.100.200.156.36798 > 10.100.2.106.60001: UDP, length 100
11:39:52.036356 IP 10.100.200.156.36798 > 10.100.2.106.60001: UDP, length 100
11:39:52.057713 IP 10.100.2.106.60001 > 10.100.200.156.36798: UDP, length 1252
11:39:52.059604 IP 10.100.200.156.36798 > 10.100.2.106.60001: UDP, length 102
11:39:52.081624 IP 10.100.200.156.36798 > 10.100.2.106.60001: UDP, length 105
11:39:52.103335 IP 10.100.200.156.36798 > 10.100.2.106.60001: UDP, length 112
11:39:52.125057 IP 10.100.200.156.36798 > 10.100.2.106.60001: UDP, length 103
11:39:52.138303 IP 10.100.2.106.60001 > 10.100.200.156.36798: UDP, length 1252
11:39:52.151163 IP 10.100.200.156.36798 > 10.100.2.106.60001: UDP, length 98
11:39:52.173121 IP 10.100.200.156.36798 > 10.100.2.106.60001: UDP, length 96
11:39:52.194907 IP 10.100.200.156.36798 > 10.100.2.106.60001: UDP, length 100
11:39:52.200545 IP 10.100.2.106.60001 > 10.100.200.156.36798: UDP, length 1252
11:39:52.217044 IP 10.100.200.156.36798 > 10.100.2.106.60001: UDP, length 99
11:39:52.239146 IP 10.100.200.156.36798 > 10.100.2.106.60001: UDP, length 109
11:39:52.260088 IP 10.100.200.156.36798 > 10.100.2.106.60001: UDP, length 105
11:39:52.278792 IP 10.100.2.106.60001 > 10.100.200.156.36798: UDP, length 1252
11:39:52.280338 IP 10.100.200.156.36798 > 10.100.2.106.60001: UDP, length 99
11:39:52.302876 IP 10.100.200.156.36798 > 10.100.2.106.60001: UDP, length 109
11:39:52.324773 IP 10.100.200.156.36798 > 10.100.2.106.60001: UDP, length 104
11:39:52.346376 IP 10.100.200.156.36798 > 10.100.2.106.60001: UDP, length 103
11:39:52.359138 IP 10.100.2.106.60001 > 10.100.200.156.36798: UDP, length 1252
11:39:52.368515 IP 10.100.200.156.36798 > 10.100.2.106.60001: UDP, length 97
11:39:52.390437 IP 10.100.200.156.36798 > 10.100.2.106.60001: UDP, length 110
11:39:52.411834 IP 10.100.200.156.36798 > 10.100.2.106.60001: UDP, length 110
11:39:52.420472 IP 10.100.2.106.60001 > 10.100.200.156.36798: UDP, length 1252
11:39:52.434651 IP 10.100.200.156.36798 > 10.100.2.106.60001: UDP, length 111
11:39:52.456541 IP 10.100.200.156.36798 > 10.100.2.106.60001: UDP, length 111
11:39:52.478003 IP 10.100.200.156.36798 > 10.100.2.106.60001: UDP, length 98
11:39:52.499420 IP 10.100.200.156.36798 > 10.100.2.106.60001: UDP, length 95
11:39:52.499672 IP 10.100.2.106.60001 > 10.100.200.156.36798: UDP, length 1252
11:39:52.521521 IP 10.100.200.156.36798 > 10.100.2.106.60001: UDP, length 99
11:39:52.543808 IP 10.100.200.156.36798 > 10.100.2.106.60001: UDP, length 111
11:39:52.565654 IP 10.100.200.156.36798 > 10.100.2.106.60001: UDP, length 111
11:39:52.581185 IP 10.100.2.106.60001 > 10.100.200.156.36798: UDP, length 1252
11:39:52.586502 IP 10.100.200.156.36798 > 10.100.2.106.60001: UDP, length 94
11:39:52.608600 IP 10.100.200.156.36798 > 10.100.2.106.60001: UDP, length 94
11:39:52.630320 IP 10.100.200.156.36798 > 10.100.2.106.60001: UDP, length 97
11:39:52.639913 IP 10.100.2.106.60001 > 10.100.200.156.36798: UDP, length 1252
11:39:52.651283 IP 10.100.200.156.36798 > 10.100.2.106.60001: UDP, length 110
11:39:52.673189 IP 10.100.200.156.36798 > 10.100.2.106.60001: UDP, length 101
11:39:52.695369 IP 10.100.200.156.36798 > 10.100.2.106.60001: UDP, length 111
11:39:52.718524 IP 10.100.200.156.36798 > 10.100.2.106.60001: UDP, length 97
11:39:52.720907 IP 10.100.2.106.60001 > 10.100.200.156.36798: UDP, length 1252
11:39:52.742377 IP 10.100.200.156.36798 > 10.100.2.106.60001: UDP, length 110
11:39:52.764900 IP 10.100.200.156.36798 > 10.100.2.106.60001: UDP, length 100
11:39:52.787494 IP 10.100.200.156.36798 > 10.100.2.106.60001: UDP, length 105
11:39:52.801409 IP 10.100.2.106.60001 > 10.100.200.156.36798: UDP, length 1252
11:39:52.809581 IP 10.100.200.156.36798 > 10.100.2.106.60001: UDP, length 106
11:39:52.832024 IP 10.100.200.156.36798 > 10.100.2.106.60001: UDP, length 105
11:39:52.854130 IP 10.100.200.156.36798 > 10.100.2.106.60001: UDP, length 99
11:39:52.862030 IP 10.100.2.106.60001 > 10.100.200.156.36798: UDP, length 1252
11:39:52.875843 IP 10.100.200.156.36798 > 10.100.2.106.60001: UDP, length 96
11:39:52.898046 IP 10.100.200.156.36798 > 10.100.2.106.60001: UDP, length 106
11:39:52.920666 IP 10.100.200.156.36798 > 10.100.2.106.60001: UDP, length 100
11:39:52.942347 IP 10.100.2.106.60001 > 10.100.200.156.36798: UDP, length 1252
11:39:52.942857 IP 10.100.200.156.36798 > 10.100.2.106.60001: UDP, length 95
11:39:52.965343 IP 10.100.200.156.36798 > 10.100.2.106.60001: UDP, length 105
11:39:52.987031 IP 10.100.200.156.36798 > 10.100.2.106.60001: UDP, length 102
11:39:53.009557 IP 10.100.200.156.36798 > 10.100.2.106.60001: UDP, length 111
11:39:53.021885 IP 10.100.2.106.60001 > 10.100.200.156.36798: UDP, length 1252
11:39:53.030935 IP 10.100.200.156.36798 > 10.100.2.106.60001: UDP, length 105
11:39:53.053464 IP 10.100.200.156.36798 > 10.100.2.106.60001: UDP, length 99
11:39:53.075390 IP 10.100.200.156.36798 > 10.100.2.106.60001: UDP, length 96
11:39:53.082982 IP 10.100.2.106.60001 > 10.100.200.156.36798: UDP, length 1252
11:39:53.096895 IP 10.100.200.156.36798 > 10.100.2.106.60001: UDP, length 96
11:39:53.118783 IP 10.100.200.156.36798 > 10.100.2.106.60001: UDP, length 107
11:39:53.141113 IP 10.100.200.156.36798 > 10.100.2.106.60001: UDP, length 96
11:39:53.163543 IP 10.100.2.106.60001 > 10.100.200.156.36798: UDP, length 1252
11:39:53.164573 IP 10.100.200.156.36798 > 10.100.2.106.60001: UDP, length 94
11:39:53.184921 IP 10.100.200.156.36798 > 10.100.2.106.60001: UDP, length 105
11:39:53.206640 IP 10.100.200.156.36798 > 10.100.2.106.60001: UDP, length 94
11:39:53.228395 IP 10.100.200.156.36798 > 10.100.2.106.60001: UDP, length 109
11:39:53.244801 IP 10.100.2.106.60001 > 10.100.200.156.36798: UDP, length 1252
11:39:53.249386 IP 10.100.200.156.36798 > 10.100.2.106.60001: UDP, length 96
11:39:53.271574 IP 10.100.200.156.36798 > 10.100.2.106.60001: UDP, length 111
11:39:53.294217 IP 10.100.200.156.36798 > 10.100.2.106.60001: UDP, length 102
11:39:53.303639 IP 10.100.2.106.60001 > 10.100.200.156.36798: UDP, length 1252
11:39:53.315399 IP 10.100.200.156.36798 > 10.100.2.106.60001: UDP, length 104
11:39:53.336879 IP 10.100.200.156.36798 > 10.100.2.106.60001: UDP, length 107
11:39:53.358648 IP 10.100.200.156.36798 > 10.100.2.106.60001: UDP, length 100
11:39:53.380270 IP 10.100.200.156.36798 > 10.100.2.106.60001: UDP, length 105
11:39:53.384477 IP 10.100.2.106.60001 > 10.100.200.156.36798: UDP, length 1252
11:39:53.402363 IP 10.100.200.156.36798 > 10.100.2.106.60001: UDP, length 111
11:39:53.424073 IP 10.100.200.156.36798 > 10.100.2.106.60001: UDP, length 104
11:39:53.445941 IP 10.100.200.156.36798 > 10.100.2.106.60001: UDP, length 105
11:39:53.464165 IP 10.100.2.106.60001 > 10.100.200.156.36798: UDP, length 1252
11:39:53.466812 IP 10.100.200.156.36798 > 10.100.2.106.60001: UDP, length 111
11:39:53.489139 IP 10.100.200.156.36798 > 10.100.2.106.60001: UDP, length 106
11:39:53.511276 IP 10.100.200.156.36798 > 10.100.2.106.60001: UDP, length 104
11:39:53.523884 IP 10.100.2.106.60001 > 10.100.200.156.36798: UDP, length 1252
11:39:53.532761 IP 10.100.200.156.36798 > 10.100.2.106.60001: UDP, length 108
11:39:53.555480 IP 10.100.200.156.36798 > 10.100.2.106.60001: UDP, length 105
11:39:53.577631 IP 10.100.200.156.36798 > 10.100.2.106.60001: UDP, length 96
11:39:53.599503 IP 10.100.200.156.36798 > 10.100.2.106.60001: UDP, length 101
11:39:53.605220 IP 10.100.2.106.60001 > 10.100.200.156.36798: UDP, length 1252
11:39:53.622206 IP 10.100.200.156.36798 > 10.100.2.106.60001: UDP, length 102
11:39:53.644462 IP 10.100.200.156.36798 > 10.100.2.106.60001: UDP, length 98
11:39:53.666586 IP 10.100.200.156.36798 > 10.100.2.106.60001: UDP, length 106
11:39:53.685043 IP 10.100.2.106.60001 > 10.100.200.156.36798: UDP, length 1252
11:39:53.687774 IP 10.100.200.156.36798 > 10.100.2.106.60001: UDP, length 96
11:39:53.709427 IP 10.100.200.156.36798 > 10.100.2.106.60001: UDP, length 104
11:39:53.731219 IP 10.100.200.156.36798 > 10.100.2.106.60001: UDP, length 107
11:39:53.752781 IP 10.100.200.156.36798 > 10.100.2.106.60001: UDP, length 107
11:39:53.765462 IP 10.100.2.106.60001 > 10.100.200.156.36798: UDP, length 1252
11:39:53.775491 IP 10.100.200.156.36798 > 10.100.2.106.60001: UDP, length 101
11:39:53.797824 IP 10.100.200.156.36798 > 10.100.2.106.60001: UDP, length 105
11:39:53.819749 IP 10.100.200.156.36798 > 10.100.2.106.60001: UDP, length 103
11:39:53.841234 IP 10.100.200.156.36798 > 10.100.2.106.60001: UDP, length 107
11:39:53.845864 IP 10.100.2.106.60001 > 10.100.200.156.36798: UDP, length 1252
11:39:53.862693 IP 10.100.200.156.36798 > 10.100.2.106.60001: UDP, length 95
11:39:53.884896 IP 10.100.200.156.36798 > 10.100.2.106.60001: UDP, length 100
11:39:53.906873 IP 10.100.200.156.36798 > 10.100.2.106.60001: UDP, length 94
11:39:53.926324 IP 10.100.2.106.60001 > 10.100.200.156.36798: UDP, length 1252
11:39:53.927714 IP 10.100.200.156.36798 > 10.100.2.106.60001: UDP, length 109
11:39:53.949827 IP 10.100.200.156.36798 > 10.100.2.106.60001: UDP, length 109
11:39:53.973042 IP 10.100.200.156.36798 > 10.100.2.106.60001: UDP, length 103
11:39:53.995528 IP 10.100.200.156.36798 > 10.100.2.106.60001: UDP, length 98
11:39:54.005904 IP 10.100.2.106.60001 > 10.100.200.156.36798: UDP, length 1252
11:39:54.017321 IP 10.100.200.156.36798 > 10.100.2.106.60001: UDP, length 111
11:39:54.040306 IP 10.100.200.156.36798 > 10.100.2.106.60001: UDP, length 104
11:39:54.061999 IP 10.100.200.156.36798 > 10.100.2.106.60001: UDP, length 97
11:39:54.066972 IP 10.100.2.106.60001 > 10.100.200.156.36798: UDP, length 1252
11:39:54.084050 IP 10.100.200.156.36798 > 10.100.2.106.60001: UDP, length 106
11:39:54.106104 IP 10.100.200.156.36798 > 10.100.2.106.60001: UDP, length 95
11:39:54.128053 IP 10.100.200.156.36798 > 10.100.2.106.60001: UDP, length 96
11:39:54.147279 IP 10.100.2.106.60001 > 10.100.200.156.36798: UDP, length 1252
11:39:54.148604 IP 10.100.200.156.36798 > 10.100.2.106.60001: UDP, length 104
11:39:54.172372 IP 10.100.200.156.36798 > 10.100.2.106.60001: UDP, length 94
11:39:54.195147 IP 10.100.200.156.36798 > 10.100.2.106.60001: UDP, length 99
11:39:54.217007 IP 10.100.200.156.36798 > 10.100.2.106.60001: UDP, length 94
11:39:54.227400 IP 10.100.2.106.60001 > 10.100.200.156.36798: UDP, length 1252
11:39:54.238598 IP 10.100.200.156.36798 > 10.100.2.106.60001: UDP, length 110
11:39:54.260872 IP 10.100.200.156.36798 > 10.100.2.106.60001: UDP, length 107
11:39:54.283097 IP 10.100.200.156.36798 > 10.100.2.106.60001: UDP, length 108
11:39:54.289370 IP 10.100.2.106.60001 > 10.100.200.156.36798: UDP, length 1252
11:39:54.304232 IP 10.100.200.156.36798 > 10.100.2.106.60001: UDP, length 104
11:39:54.326771 IP 10.100.200.156.36798 > 10.100.2.106.60001: UDP, length 109
11:39:54.348972 IP 10.100.200.156.36798 > 10.100.2.106.60001: UDP, length 103
11:39:54.368865 IP 10.100.2.106.60001 > 10.100.200.156.36798: UDP, length 1252
11:39:54.370279 IP 10.100.200.156.36798 > 10.100.2.106.60001: UDP, length 103
11:39:54.391763 IP 10.100.200.156.36798 > 10.100.2.106.60001: UDP, length 96
11:39:54.413996 IP 10.100.200.156.36798 > 10.100.2.106.60001: UDP, length 99
11:39:54.436224 IP 10.100.200.156.36798 > 10.100.2.106.60001: UDP, length 95
11:39:54.449330 IP 10.100.2.106.60001 > 10.100.200.156.36798: UDP, length 1252
11:39:54.457977 IP 10.100.200.156.36798 > 10.100.2.106.60001: UDP, length 111
11:39:54.480268 IP 10.100.200.156.36798 > 10.100.2.106.60001: UDP, length 96
11:39:54.502216 IP 10.100.200.156.36798 > 10.100.2.106.60001: UDP, length 95
11:39:54.510377 IP 10.100.2.106.60001 > 10.100.200.156.36798: UDP, length 1252
11:39:54.524499 IP 10.100.200.156.36798 > 10.100.2.106.60001: UDP, length 110
11:39:54.546850 IP 10.100.200.156.36798 > 10.100.2.106.60001: UDP, length 108
11:39:54.568686 IP 10.100.200.156.36798 > 10.100.2.106.60001: UDP, length 95
11:39:54.589861 IP 10.100.2.106.60001 > 10.100.200.156.36798: UDP, length 1252
11:39:54.590430 IP 10.100.200.156.36798 > 10.100.2.106.60001: UDP, length 94
11:39:54.612483 IP 10.100.200.156.36798 > 10.100.2.106.60001: UDP, length 104
11:39:54.634645 IP 10.100.200.156.36798 > 10.100.2.106.60001: UDP, length 103
11:39:54.656484 IP 10.100.200.156.36798 > 10.100.2.106.60001: UDP, length 94
11:39:54.670171 IP 10.100.2.106.60001 > 10.100.200.156.36798: UDP, length 1252
11:39:54.679211 IP 10.100.200.156.36798 > 10.100.2.106.60001: UDP, length 108
11:39:54.701027 IP 10.100.200.156.36798 > 10.100.2.106.60001: UDP, length 103
11:39:54.722541 IP 10.100.200.156.36798 > 10.100.2.106.60001: UDP, length 99
11:39:54.731484 IP 10.100.2.106.60001 > 10.100.200.156.36798: UDP, length 1252
11:39:54.744538 IP 10.100.200.156.36798 > 10.100.2.106.60001: UDP, length 107
11:39:54.767191 IP 10.100.200.156.36798 > 10.100.2.106.60001: UDP, length 111
11:39:54.788810 IP 10.100.200.156.36798 > 10.100.2.106.60001: UDP, length 96
11:39:54.810690 IP 10.100.200.156.36798 > 10.100.2.106.60001: UDP, length 102
11:39:54.810964 IP 10.100.2.106.60001 > 10.100.200.156.36798: UDP, length 1252
11:39:54.832788 IP 10.100.200.156.36798 > 10.100.2.106.60001: UDP, length 95
11:39:54.854481 IP 10.100.200.156.36798 > 10.100.2.106.60001: UDP, length 104
11:39:54.876067 IP 10.100.200.156.36798 > 10.100.2.106.60001: UDP, length 105
11:39:54.891057 IP 10.100.2.106.60001 > 10.100.200.156.36798: UDP, length 1252
11:39:54.898646 IP 10.100.200.156.36798 > 10.100.2.106.60001: UDP, length 102
11:39:54.920691 IP 10.100.200.156.36798 > 10.100.2.106.60001: UDP, length 99
11:39:54.942729 IP 10.100.200.156.36798 > 10.100.2.106.60001: UDP, length 103
11:39:54.964693 IP 10.100.200.156.36798 > 10.100.2.106.60001: UDP, length 107
11:39:54.972105 IP 10.100.2.106.60001 > 10.100.200.156.36798: UDP, length 1252
11:39:54.987322 IP 10.100.200.156.36798 > 10.100.2.106.60001: UDP, length 106
11:39:55.010220 IP 10.100.200.156.36798 > 10.100.2.106.60001: UDP, length 96
11:39:55.032122 IP 10.100.200.156.36798 > 10.100.2.106.60001: UDP, length 97
11:39:55.052323 IP 10.100.2.106.60001 > 10.100.200.156.36798: UDP, length 1252
11:39:55.054004 IP 10.100.200.156.36798 > 10.100.2.106.60001: UDP, length 97
11:39:55.075689 IP 10.100.200.156.36798 > 10.100.2.106.60001: UDP, length 103
11:39:55.097558 IP 10.100.200.156.36798 > 10.100.2.106.60001: UDP, length 110
11:39:55.112187 IP 10.100.2.106.60001 > 10.100.200.156.36798: UDP, length 1252
11:39:55.118390 IP 10.100.200.156.59369 > 10.100.2.106.60001: UDP, length 111
11:39:55.140490 IP 10.100.200.156.59369 > 10.100.2.106.60001: UDP, length 104
11:39:55.162639 IP 10.100.200.156.59369 > 10.100.2.106.60001: UDP, length 97
11:39:55.184446 IP 10.100.200.156.59369 > 10.100.2.106.60001: UDP, length 106
11:39:55.193041 IP 10.100.2.106.60001 > 10.100.200.156.59369: UDP, length 1252
11:39:55.274682 IP 10.100.2.106.60001 > 10.100.200.156.59369: UDP, length 1252
11:39:55.335926 IP 10.100.2.106.60001 > 10.100.200.156.59369: UDP, length 1252
11:39:55.418473 IP 10.100.2.106.60001 > 10.100.200.156.59369: UDP, length 1252
11:39:55.478944 IP 10.100.2.106.60001 > 10.100.200.156.59369: UDP, length 1252
11:39:55.560910 IP 10.100.2.106.60001 > 10.100.200.156.59369: UDP, length 1252
11:39:55.642324 IP 10.100.2.106.60001 > 10.100.200.156.59369: UDP, length 1252
11:39:55.703548 IP 10.100.2.106.60001 > 10.100.200.156.59369: UDP, length 1252
11:39:55.785576 IP 10.100.2.106.60001 > 10.100.200.156.59369: UDP, length 1252
11:39:55.847135 IP 10.100.2.106.60001 > 10.100.200.156.59369: UDP, length 1252
11:39:55.928720 IP 10.100.2.106.60001 > 10.100.200.156.59369: UDP, length 1252
11:39:56.010668 IP 10.100.2.106.60001 > 10.100.200.156.59369: UDP, length 1252
11:39:56.072057 IP 10.100.2.106.60001 > 10.100.200.156.59369: UDP, length 1252
11:39:56.153335 IP 10.100.2.106.60001 > 10.100.200.156.59369: UDP, length 1252
11:39:56.214670 IP 10.100.2.106.60001 > 10.100.200.156.59369: UDP, length 1252
11:39:58.186612 IP 10.100.200.156.59369 > 10.100.2.106.60001: UDP, length 98
11:39:59.216891 IP 10.100.2.106.60001 > 10.100.200.156.59369: UDP, length 1005
11:40:01.189513 IP 10.100.200.156.59369 > 10.100.2.106.60001: UDP, length 102
11:40:02.217515 IP 10.100.2.106.60001 > 10.100.200.156.59369: UDP, length 1252
11:40:02.217633 IP 10.100.2.106.60001 > 10.100.200.156.59369: UDP, length 1020
11:40:02.336496 IP 10.100.200.156.59369 > 10.100.2.106.60001: UDP, length 69
```

**Comment by achernya** [comment]
This is working-as-designed. mosh synchronizes the state between the client and the server, and attempts to reach the server when there is a network event to inform it of a new IP address if the client roamed.
